{
  "id": "k16_stock",
  "engine": "k16_vvt",
  "description": "Mapa de serie K16 1.6 VVT 120 CV",
  "tables": [
    {
      "id": "lambda_target",
      "unit": "lambda",
      "x": {
        "name": "rpm",
        "unit": "rpm",
        "values": [800, 1200, 1600, 2000, 2500, 3000, 3500, 4000, 4500, 5000, 5500, 6000, 6500, 7000, 7500]
      },
      "y": {
        "name": "load",
        "unit": "rel",
        "values": [0.1, 0.2, 0.3, 0.4, 0.55, 0.7, 0.85, 1, 1.1]
      },
      "values": [
        [1, 1, 1, 1, 1, 1, 1, 1, 1, 1, 1, 1, 1, 1, 1],
        [1, 1, 1, 1, 1, 1, 1, 1, 1, 1, 1, 1, 1, 1, 1],
        [1, 1, 1, 1, 1, 1, 1, 1, 1, 1, 1, 1, 1, 1, 1],
        [1, 1, 1, 1, 1, 1, 1, 1, 1, 1, 1, 1, 1, 1, 1],
        [1, 1, 1, 1, 1, 1, 1, 1, 1, 1, 1, 1, 1, 1, 1],
        [1, 1, 1, 1, 1, 1, 1, 1, 1, 1, 1, 1, 1, 1, 1],
        [0.9662, 0.9662, 0.9662, 0.9662, 0.9662, 0.9662, 0.9662, 0.9662, 0.9662, 0.9662, 0.9662, 0.9662, 0.9662, 0.9662, 0.9662],
        [0.88, 0.88, 0.88, 0.88, 0.88, 0.88, 0.88, 0.88, 0.88, 0.88, 0.88, 0.88, 0.88, 0.88, 0.88],
        [0.88, 0.88, 0.88, 0.88, 0.88, 0.88, 0.88, 0.88, 0.88, 0.88, 0.88, 0.88, 0.88, 0.88, 0.88]
      ]
    },
    {
      "id": "ignition_advance",
      "unit": "deg",
      "x": {
        "name": "rpm",
        "unit": "rpm",
        "values": [800, 1200, 1600, 2000, 2500, 3000, 3500, 4000, 4500, 5000, 5500, 6000, 6500, 7000, 7500]
      },
      "y": {
        "name": "load",
        "unit": "rel",
        "values": [0.1, 0.2, 0.3, 0.4, 0.55, 0.7, 0.85, 1, 1.1]
      },
      "values": [
        [12, 38.17, 38.61, 39.05, 39.6, 40.15, 40.7, 41.25, 41.8, 42.35, 42.9, 43.45, 44, 44, 44],
        [12, 36.77, 37.21, 37.65, 38.2, 38.75, 39.3, 39.85, 40.4, 40.95, 41.5, 42.05, 42.6, 43.15, 43.7],
        [12, 35.37, 35.81, 36.25, 36.8, 37.35, 37.9, 38.45, 39, 39.55, 40.1, 40.65, 41.2, 41.75, 42.3],
        [28.9205, 33.6005, 34.2805, 34.85, 35.4, 35.95, 36.5, 37.05, 37.6, 38.15, 38.7, 39.25, 39.8, 40.35, 40.9],
        [25.3995, 30.0795, 30.7595, 31.4395, 32.2895, 33.1395, 33.9895, 34.8395, 35.5, 36.05, 36.6, 37.15, 37.7, 38.25, 38.8],
        [21.8784, 26.5584, 27.2384, 27.9184, 28.7684, 29.6184, 30.4684, 31.3184, 32.1684, 33.0184, 33.8684, 34.7184, 35.5684, 36.15, 36.7],
        [18.9659, 23.6459, 24.3259, 25.0059, 25.8559, 26.7059, 27.5559, 28.4059, 29.2559, 30.1059, 30.9559, 31.8059, 32.6559, 33.5059, 34.3559],
        [16.9963, 21.6763, 22.3563, 23.0363, 23.8863, 24.7363, 25.5863, 26.4363, 27.2863, 28.1363, 28.9863, 29.8363, 30.6863, 31.5363, 32.3863],
        [15.7489, 20.4289, 21.1089, 21.7889, 22.6389, 23.4889, 24.3389, 25.1889, 26.0389, 26.8889, 27.7389, 28.5889, 29.4389, 30.2889, 31.1389]
      ]
    },
    {
      "id": "ve_estimate",
      "unit": "fraction",
      "x": {
        "name": "rpm",
        "unit": "rpm",
        "values": [800, 1200, 1600, 2000, 2500, 3000, 3500, 4000, 4500, 5000, 5500, 6000, 6500, 7000, 7500]
      },
      "y": {
        "name": "map",
        "unit": "kPa",
        "values": [15, 25, 40, 55, 70, 85, 100, 110]
      },
      "values": [
        [0.5997, 0.6348, 0.6661, 0.6938, 0.7231, 0.7468, 0.7646, 0.7767, 0.783, 0.7823, 0.7625, 0.7206, 0.6567, 0.5707, 0.4628],
        [0.6254, 0.6619, 0.6946, 0.7234, 0.7541, 0.7787, 0.7973, 0.8099, 0.8166, 0.8158, 0.7951, 0.7514, 0.6848, 0.5952, 0.4826],
        [0.6608, 0.6993, 0.7339, 0.7643, 0.7967, 0.8227, 0.8424, 0.8557, 0.8627, 0.8619, 0.8401, 0.7939, 0.7235, 0.6288, 0.5098],
        [0.6919, 0.7323, 0.7685, 0.8004, 0.8343, 0.8615, 0.8821, 0.8961, 0.9034, 0.9026, 0.8797, 0.8314, 0.7576, 0.6585, 0.5339],
        [0.7182, 0.7602, 0.7977, 0.8308, 0.866, 0.8943, 0.9157, 0.9302, 0.9378, 0.9369, 0.9131, 0.863, 0.7864, 0.6835, 0.5542],
        [0.7386, 0.7817, 0.8203, 0.8543, 0.8905, 0.9196, 0.9416, 0.9565, 0.9643, 0.9634, 0.939, 0.8874, 0.8087, 0.7028, 0.5699],
        [0.7497, 0.7935, 0.8326, 0.8672, 0.9039, 0.9334, 0.9558, 0.9709, 0.9788, 0.9779, 0.9531, 0.9008, 0.8209, 0.7134, 0.5784],
        [0.7497, 0.7935, 0.8326, 0.8672, 0.9039, 0.9334, 0.9558, 0.9709, 0.9788, 0.9779, 0.9531, 0.9008, 0.8209, 0.7134, 0.5784]
      ]
    },
    {
      "id": "cam_target",
      "unit": "deg",
      "x": {
        "name": "rpm",
        "unit": "rpm",
        "values": [800, 1200, 1600, 2000, 2500, 3000, 3500, 4000, 4500, 5000, 5500, 6000, 6500, 7000, 7500]
      },
      "y": {
        "name": "load",
        "unit": "rel",
        "values": [0.1, 0.2, 0.3, 0.4, 0.55, 0.7, 0.85, 1, 1.1]
      },
      "values": [
        [0, 0, 0, 0, 0, 0, 0, 0, 0, 0, 0, 0, 0, 0, 0],
        [0, 0, 0, 0, 0, 0, 0, 0, 0, 0, 0, 0, 0, 0, 0],
        [0, 0.024, 0.4445, 0.9391, 1.0288, 1.0288, 1.0288, 1.0288, 0.9913, 0.8115, 0.5854, 0.4288, 0.4115, 0.4115, 0.4115],
        [0, 0.1812, 3.36, 7.0999, 7.7778, 7.7778, 7.7778, 7.7778, 7.4943, 6.1351, 4.4259, 3.2418, 3.1111, 3.1111, 3.1111],
        [0, 0.5176, 9.6001, 20.2855, 22.2222, 22.2222, 22.2222, 22.2222, 21.4122, 17.5289, 12.6456, 9.2622, 8.8889, 8.8889, 8.8889],
        [0, 0.6987, 12.9602, 27.3854, 30, 30, 30, 30, 28.9065, 23.664, 17.0715, 12.504, 12, 12, 12],
        [0, 0.6987, 12.9602, 27.3854, 30, 30, 30, 30, 28.9065, 23.664, 17.0715, 12.504, 12, 12, 12],
        [0, 0.6987, 12.9602, 27.3854, 30, 30, 30, 30, 28.9065, 23.664, 17.0715, 12.504, 12, 12, 12],
        [0, 0.6987, 12.9602, 27.3854, 30, 30, 30, 30, 28.9065, 23.664, 17.0715, 12.504, 12, 12, 12]
      ]
    }
  ],
  "curves": [
    {
      "id": "pedal_to_throttle",
      "unit": "%",
      "x": {
        "name": "pedal",
        "unit": "%",
        "values": [0, 10, 25, 50, 75, 100]
      },
      "values": [0, 4, 14, 38, 70, 100]
    },
    {
      "id": "ect_fuel_correction",
      "unit": "factor",
      "x": {
        "name": "ect",
        "unit": "°C",
        "values": [-20, 0, 20, 40, 60, 80]
      },
      "values": [1.45, 1.3, 1.15, 1.07, 1.02, 1]
    },
    {
      "id": "iat_ignition_correction",
      "unit": "deg",
      "x": {
        "name": "iat",
        "unit": "°C",
        "values": [-10, 20, 40, 55, 70, 90]
      },
      "values": [1, 0, 0, -1.5, -4, -7]
    },
    {
      "id": "ect_ignition_correction",
      "unit": "deg",
      "x": {
        "name": "ect",
        "unit": "°C",
        "values": [0, 40, 90, 105, 115]
      },
      "values": [3, 1.5, 0, -2, -5]
    }
  ],
  "scalars": {
    "rev_limit_rpm": 6600,
    "speed_limit_kmh": 195,
    "idle_rpm": 750,
    "idle_cold_rpm": 1150,
    "injector_flow_ccmin": 190,
    "maf_max_gps": 110,
    "injector_dead_time_ms": 0.5,
    "fan_on_c": 101,
    "fan_off_c": 96,
    "knock_retard_step_deg": 1.5,
    "knock_retard_max_deg": 10,
    "rail_pressure_target_kpa": 350,
    "map_sensor_max_kpa": 105
  }
}
