{
  "id": "d16_stock",
  "engine": "d16_crd",
  "description": "Mapa de serie D16 1.6 CRD 120 CV (Euro 6, FAP)",
  "tables": [
    {
      "id": "lambda_target",
      "unit": "lambda",
      "x": {
        "name": "rpm",
        "unit": "rpm",
        "values": [800, 1200, 1600, 2000, 2500, 3000, 3500, 4000, 4500, 5000, 5500, 6000, 6500, 7000, 7500]
      },
      "y": {
        "name": "load",
        "unit": "rel",
        "values": [0.1, 0.2, 0.35, 0.5, 0.7, 0.9, 1.1, 1.4, 1.7, 2, 2.4]
      },
      "values": [
        [1, 1, 1, 1, 1, 1, 1, 1, 1, 1, 1, 1, 1, 1, 1],
        [1, 1, 1, 1, 1, 1, 1, 1, 1, 1, 1, 1, 1, 1, 1],
        [1, 1, 1, 1, 1, 1, 1, 1, 1, 1, 1, 1, 1, 1, 1],
        [1, 1, 1, 1, 1, 1, 1, 1, 1, 1, 1, 1, 1, 1, 1],
        [1, 1, 1, 1, 1, 1, 1, 1, 1, 1, 1, 1, 1, 1, 1],
        [1, 1, 1, 1, 1, 1, 1, 1, 1, 1, 1, 1, 1, 1, 1],
        [1, 1, 1, 1, 1, 1, 1, 1, 1, 1, 1, 1, 1, 1, 1],
        [1, 1, 1, 1, 1, 1, 1, 1, 1, 1, 1, 1, 1, 1, 1],
        [1, 1, 1, 1, 1, 1, 1, 1, 1, 1, 1, 1, 1, 1, 1],
        [1, 1, 1, 1, 1, 1, 1, 1, 1, 1, 1, 1, 1, 1, 1],
        [1, 1, 1, 1, 1, 1, 1, 1, 1, 1, 1, 1, 1, 1, 1]
      ]
    },
    {
      "id": "ignition_advance",
      "unit": "deg",
      "x": {
        "name": "rpm",
        "unit": "rpm",
        "values": [800, 1200, 1600, 2000, 2500, 3000, 3500, 4000, 4500, 5000, 5500, 6000, 6500, 7000, 7500]
      },
      "y": {
        "name": "load",
        "unit": "rel",
        "values": [0.1, 0.2, 0.35, 0.5, 0.7, 0.9, 1.1, 1.4, 1.7, 2, 2.4]
      },
      "values": [
        [3.1714, 3.8571, 4.5429, 5.2286, 6.0857, 6.9429, 7.8, 7.8, 7.8, 7.8, 7.8, 7.8, 7.8, 7.8, 7.8],
        [2.9714, 3.6571, 4.3429, 5.0286, 5.8857, 6.7429, 7.6, 7.6, 7.6, 7.6, 7.6, 7.6, 7.6, 7.6, 7.6],
        [2.6714, 3.3571, 4.0429, 4.7286, 5.5857, 6.4429, 7.3, 7.3, 7.3, 7.3, 7.3, 7.3, 7.3, 7.3, 7.3],
        [2.3714, 3.0571, 3.7429, 4.4286, 5.2857, 6.1429, 7, 7, 7, 7, 7, 7, 7, 7, 7],
        [1.9714, 2.6571, 3.3429, 4.0286, 4.8857, 5.7429, 6.6, 6.6, 6.6, 6.6, 6.6, 6.6, 6.6, 6.6, 6.6],
        [1.5714, 2.2571, 2.9429, 3.6286, 4.4857, 5.3429, 6.2, 6.2, 6.2, 6.2, 6.2, 6.2, 6.2, 6.2, 6.2],
        [1.3714, 2.0571, 2.7429, 3.4286, 4.2857, 5.1429, 6, 6, 6, 6, 6, 6, 6, 6, 6],
        [1.3714, 2.0571, 2.7429, 3.4286, 4.2857, 5.1429, 6, 6, 6, 6, 6, 6, 6, 6, 6],
        [1.3714, 2.0571, 2.7429, 3.4286, 4.2857, 5.1429, 6, 6, 6, 6, 6, 6, 6, 6, 6],
        [1.3714, 2.0571, 2.7429, 3.4286, 4.2857, 5.1429, 6, 6, 6, 6, 6, 6, 6, 6, 6],
        [1.3714, 2.0571, 2.7429, 3.4286, 4.2857, 5.1429, 6, 6, 6, 6, 6, 6, 6, 6, 6]
      ]
    },
    {
      "id": "ve_estimate",
      "unit": "fraction",
      "x": {
        "name": "rpm",
        "unit": "rpm",
        "values": [800, 1200, 1600, 2000, 2500, 3000, 3500, 4000, 4500, 5000, 5500, 6000, 6500, 7000, 7500]
      },
      "y": {
        "name": "map",
        "unit": "kPa",
        "values": [20, 40, 60, 80, 100, 130, 160, 200, 250]
      },
      "values": [
        [0.8456, 0.8601, 0.8704, 0.8766, 0.8783, 0.8668, 0.8389, 0.7946, 0.7338, 0.6566, 0.563, 0.453, 0.3465, 0.3465, 0.3465],
        [0.8598, 0.8745, 0.885, 0.8913, 0.8931, 0.8814, 0.853, 0.8079, 0.7461, 0.6677, 0.5725, 0.4606, 0.3465, 0.3465, 0.3465],
        [0.8718, 0.8867, 0.8973, 0.9037, 0.9055, 0.8936, 0.8649, 0.8192, 0.7565, 0.677, 0.5805, 0.467, 0.3465, 0.3465, 0.3465],
        [0.881, 0.8961, 0.9068, 0.9133, 0.9151, 0.9031, 0.874, 0.8278, 0.7645, 0.6841, 0.5866, 0.472, 0.3465, 0.3465, 0.3465],
        [0.8861, 0.9012, 0.912, 0.9185, 0.9204, 0.9083, 0.8791, 0.8326, 0.7689, 0.6881, 0.59, 0.4747, 0.3465, 0.3465, 0.3465],
        [0.8861, 0.9012, 0.912, 0.9185, 0.9204, 0.9083, 0.8791, 0.8326, 0.7689, 0.6881, 0.59, 0.4747, 0.3465, 0.3465, 0.3465],
        [0.8861, 0.9012, 0.912, 0.9185, 0.9204, 0.9083, 0.8791, 0.8326, 0.7689, 0.6881, 0.59, 0.4747, 0.3465, 0.3465, 0.3465],
        [0.8861, 0.9012, 0.912, 0.9185, 0.9204, 0.9083, 0.8791, 0.8326, 0.7689, 0.6881, 0.59, 0.4747, 0.3465, 0.3465, 0.3465],
        [0.8861, 0.9012, 0.912, 0.9185, 0.9204, 0.9083, 0.8791, 0.8326, 0.7689, 0.6881, 0.59, 0.4747, 0.3465, 0.3465, 0.3465]
      ]
    },
    {
      "id": "boost_target",
      "unit": "kPa",
      "x": {
        "name": "rpm",
        "unit": "rpm",
        "values": [800, 1200, 1600, 2000, 2500, 3000, 3500, 4000, 4500, 5000, 5500, 6000, 6500, 7000, 7500]
      },
      "y": {
        "name": "pedal",
        "unit": "%",
        "values": [0, 10, 20, 35, 50, 70, 85, 100]
      },
      "values": [
        [0, 0, 0, 0, 0, 0, 0, 0, 0, 0, 0, 0, 0, 0, 0],
        [0, 0, 0, 0, 0, 0, 0, 0, 0, 0, 0, 0, 0, 0, 0],
        [0, 0, 0, 0, 0, 0, 0, 0, 0, 0, 0, 0, 0, 0, 0],
        [1.9117, 2.4195, 7.3182, 7.6468, 7.6468, 7.6468, 7.6236, 7.0378, 6.3581, 6.2704, 6.2704, 6.2704, 6.2704, 6.2704, 6.2704],
        [9.8999, 12.5295, 37.8979, 39.5995, 39.5995, 39.5995, 39.4794, 36.4459, 32.9258, 32.4716, 32.4716, 32.4716, 32.4716, 32.4716, 32.4716],
        [23.2271, 29.3968, 88.9163, 92.9085, 92.9085, 92.9085, 92.6269, 85.5097, 77.2507, 76.185, 76.185, 76.185, 76.185, 76.185, 76.185],
        [29.4948, 37.3293, 112.9096, 117.9791, 117.9791, 117.9791, 117.6214, 108.5837, 98.0961, 96.7428, 96.7428, 96.7428, 96.7428, 96.7428, 96.7428],
        [30, 37.9688, 114.8438, 120, 120, 120, 119.6362, 110.4437, 99.7764, 98.4, 98.4, 98.4, 98.4, 98.4, 98.4]
      ]
    },
    {
      "id": "wastegate_duty",
      "unit": "%",
      "x": {
        "name": "rpm",
        "unit": "rpm",
        "values": [800, 1200, 1600, 2000, 2500, 3000, 3500, 4000, 4500, 5000, 5500, 6000, 6500, 7000, 7500]
      },
      "y": {
        "name": "pedal",
        "unit": "%",
        "values": [0, 10, 20, 35, 50, 70, 85, 100]
      },
      "values": [
        [0, 0, 0, 0, 0, 0, 0, 0, 0, 0, 0, 0, 0, 0, 0],
        [0, 0, 0, 0, 0, 0, 0, 0, 0, 0, 0, 0, 0, 0, 0],
        [0, 0, 0, 0, 0, 0, 0, 0, 0, 0, 0, 0, 0, 0, 0],
        [0, 0, 0, 0, 0, 0, 0, 0, 0, 0, 0, 0, 0, 0, 0],
        [0, 0, 9.8599, 10.7973, 10.7973, 10.7973, 10.7312, 9.06, 7.1208, 6.8706, 6.8706, 6.8706, 6.8706, 6.8706, 6.8706],
        [1.7778, 5.1767, 37.9659, 40.1652, 40.1652, 40.1652, 40.01, 36.0892, 31.5393, 30.9522, 30.9522, 30.9522, 30.9522, 30.9522, 30.9522],
        [5.2306, 9.5467, 51.1838, 53.9765, 53.9765, 53.9765, 53.7795, 48.8006, 43.023, 42.2775, 42.2775, 42.2775, 42.2775, 42.2775, 42.2775],
        [5.509, 9.899, 52.2493, 55.0898, 55.0898, 55.0898, 54.8894, 49.8253, 43.9487, 43.1904, 43.1904, 43.1904, 43.1904, 43.1904, 43.1904]
      ]
    },
    {
      "id": "diesel_quantity",
      "unit": "mg/stroke",
      "x": {
        "name": "rpm",
        "unit": "rpm",
        "values": [800, 1200, 1600, 2000, 2500, 3000, 3500, 4000, 4500, 5000, 5500, 6000, 6500, 7000, 7500]
      },
      "y": {
        "name": "pedal",
        "unit": "%",
        "values": [0, 10, 20, 35, 50, 70, 85, 100]
      },
      "values": [
        [0, 0, 0, 0, 0, 0, 0, 0, 0, 0, 0, 0, 0, 0, 0],
        [0.4052, 0.4179, 0.4255, 0.428, 0.424, 0.4122, 0.3924, 0.3647, 0.3291, 0.2855, 0.2341, 0.1747, 0.1075, 0.0323, 0],
        [3.3662, 3.4714, 3.5345, 3.5556, 3.5227, 3.4241, 3.2597, 3.0296, 2.7337, 2.3721, 1.9448, 1.4517, 0.8928, 0.2682, 0],
        [11.7817, 12.1499, 12.3708, 12.4444, 12.3294, 11.9842, 11.4089, 10.6036, 9.568, 8.3024, 6.8067, 5.0809, 3.1249, 0.9389, 0],
        [22.7219, 23.432, 23.858, 24, 23.7781, 23.1124, 22.003, 20.4497, 18.4527, 16.0118, 13.1272, 9.7988, 6.0266, 1.8107, 0],
        [36.8724, 38.0247, 38.716, 38.9465, 38.5864, 37.5062, 35.7058, 33.1852, 29.9444, 25.9835, 21.3025, 15.9012, 9.7798, 2.9383, 0],
        [43.8854, 45.2568, 46.0796, 46.3539, 45.9253, 44.6396, 42.4968, 39.4968, 35.6397, 30.9255, 25.3541, 18.9256, 11.6399, 3.4971, 0],
        [45.4438, 46.8639, 47.716, 48, 47.5562, 46.2249, 44.0059, 40.8994, 36.9053, 32.0237, 26.2544, 19.5976, 12.0533, 3.6213, 0]
      ]
    }
  ],
  "curves": [
    {
      "id": "pedal_to_throttle",
      "unit": "%",
      "x": {
        "name": "pedal",
        "unit": "%",
        "values": [0, 10, 25, 50, 75, 100]
      },
      "values": [0, 4, 14, 38, 70, 100]
    },
    {
      "id": "ect_fuel_correction",
      "unit": "factor",
      "x": {
        "name": "ect",
        "unit": "°C",
        "values": [-20, 0, 20, 40, 60, 80]
      },
      "values": [1.45, 1.3, 1.15, 1.07, 1.02, 1]
    },
    {
      "id": "iat_ignition_correction",
      "unit": "deg",
      "x": {
        "name": "iat",
        "unit": "°C",
        "values": [-10, 20, 40, 55, 70, 90]
      },
      "values": [1, 0, 0, -1.5, -4, -7]
    },
    {
      "id": "ect_ignition_correction",
      "unit": "deg",
      "x": {
        "name": "ect",
        "unit": "°C",
        "values": [0, 40, 90, 105, 115]
      },
      "values": [3, 1.5, 0, -2, -5]
    }
  ],
  "scalars": {
    "rev_limit_rpm": 4800,
    "speed_limit_kmh": 195,
    "torque_limit_nm": 300,
    "idle_rpm": 800,
    "idle_cold_rpm": 950,
    "maf_max_gps": 150,
    "fan_on_c": 102,
    "fan_off_c": 97,
    "overboost_limit_kpa": 165,
    "rail_pressure_target_kpa": 180000,
    "smoke_limit_lambda": 1.2,
    "dpf_regen_start_g": 22,
    "dpf_regen_stop_g": 4,
    "dpf_limit_g": 45
  }
}
