{
  "id": "v30_stock",
  "engine": "v30_turbo",
  "description": "Mapa de serie R6 3.0 biturbo 380 CV",
  "tables": [
    {
      "id": "lambda_target",
      "unit": "lambda",
      "x": {
        "name": "rpm",
        "unit": "rpm",
        "values": [800, 1200, 1600, 2000, 2500, 3000, 3500, 4000, 4500, 5000, 5500, 6000, 6500, 7000, 7500]
      },
      "y": {
        "name": "load",
        "unit": "rel",
        "values": [0.1, 0.2, 0.35, 0.5, 0.7, 0.9, 1.1, 1.4, 1.7, 2, 2.4]
      },
      "values": [
        [1, 1, 1, 1, 1, 1, 1, 1, 1, 1, 1, 1, 1, 1, 1],
        [1, 1, 1, 1, 1, 1, 1, 1, 1, 1, 1, 1, 1, 1, 1],
        [1, 1, 1, 1, 1, 1, 1, 1, 1, 1, 1, 1, 1, 1, 1],
        [1, 1, 1, 1, 1, 1, 1, 1, 1, 1, 1, 1, 1, 1, 1],
        [1, 1, 1, 1, 1, 1, 1, 1, 1, 1, 1, 1, 1, 1, 1],
        [1, 1, 1, 1, 1, 1, 1, 1, 1, 1, 1, 1, 1, 1, 1],
        [0.9811, 0.9811, 0.9811, 0.9811, 0.9811, 0.9811, 0.9811, 0.9811, 0.9811, 0.9811, 0.98, 0.9781, 0.977, 0.977, 0.977],
        [0.8916, 0.8916, 0.8916, 0.8916, 0.8916, 0.8916, 0.8916, 0.8916, 0.8916, 0.8916, 0.8856, 0.8744, 0.8684, 0.8684, 0.8684],
        [0.86, 0.86, 0.86, 0.86, 0.86, 0.86, 0.86, 0.86, 0.86, 0.86, 0.8522, 0.8378, 0.83, 0.83, 0.83],
        [0.86, 0.86, 0.86, 0.86, 0.86, 0.86, 0.86, 0.86, 0.86, 0.86, 0.8522, 0.8378, 0.83, 0.83, 0.83],
        [0.86, 0.86, 0.86, 0.86, 0.86, 0.86, 0.86, 0.86, 0.86, 0.86, 0.8522, 0.8378, 0.83, 0.83, 0.83]
      ]
    },
    {
      "id": "ignition_advance",
      "unit": "deg",
      "x": {
        "name": "rpm",
        "unit": "rpm",
        "values": [800, 1200, 1600, 2000, 2500, 3000, 3500, 4000, 4500, 5000, 5500, 6000, 6500, 7000, 7500]
      },
      "y": {
        "name": "load",
        "unit": "rel",
        "values": [0.1, 0.2, 0.35, 0.5, 0.7, 0.9, 1.1, 1.4, 1.7, 2, 2.4]
      },
      "values": [
        [12, 36.4, 36.8, 37.2, 37.7, 38.2, 38.7, 39.2, 39.7, 40.2, 40.7, 41.2, 41.7, 42.2, 42.7],
        [12, 35.1, 35.5, 35.9, 36.4, 36.9, 37.4, 37.9, 38.4, 38.9, 39.4, 39.9, 40.4, 40.9, 41.4],
        [28.3142, 32.9542, 33.55, 33.95, 34.45, 34.95, 35.45, 35.95, 36.45, 36.95, 37.45, 37.95, 38.45, 38.95, 39.45],
        [24.9432, 29.5832, 30.2232, 30.8632, 31.6632, 32.4632, 33.2632, 34, 34.5, 35, 35.5, 36, 36.5, 37, 37.5],
        [20.4484, 25.0884, 25.7284, 26.3684, 27.1684, 27.9684, 28.7684, 29.5684, 30.3684, 31.1684, 31.9684, 32.7684, 33.5684, 34.3684, 34.9],
        [15.9537, 20.5937, 21.2337, 21.8737, 22.6737, 23.4737, 24.2737, 25.0737, 25.8737, 26.6737, 27.4737, 28.2737, 29.0737, 29.8737, 30.6737],
        [12.7996, 17.4396, 18.0796, 18.7196, 19.5196, 20.3196, 21.1196, 21.9196, 22.7196, 23.5196, 24.3385, 25.1737, 25.9926, 26.7926, 27.5926],
        [10.6679, 15.3079, 15.9479, 16.5879, 17.3879, 18.1879, 18.9879, 19.7879, 20.5879, 21.3879, 22.2963, 23.2976, 24.206, 25.006, 25.806],
        [7.4947, 12.1347, 12.7747, 13.4147, 14.2147, 15.0147, 15.8147, 16.6147, 17.4147, 18.2147, 19.1547, 20.2147, 21.1547, 21.9547, 22.7547],
        [3.7526, 8.3926, 9.0326, 9.6726, 10.4726, 11.2726, 12.0726, 12.8726, 13.6726, 14.4726, 15.4126, 16.4726, 17.4126, 18.2126, 19.0126],
        [-1.2368, 3.4032, 4.0432, 4.6832, 5.4832, 6.2832, 7.0832, 7.8832, 8.6832, 9.4832, 10.4232, 11.4832, 12.4232, 13.2232, 14.0232]
      ]
    },
    {
      "id": "ve_estimate",
      "unit": "fraction",
      "x": {
        "name": "rpm",
        "unit": "rpm",
        "values": [800, 1200, 1600, 2000, 2500, 3000, 3500, 4000, 4500, 5000, 5500, 6000, 6500, 7000, 7500]
      },
      "y": {
        "name": "map",
        "unit": "kPa",
        "values": [20, 40, 60, 80, 100, 130, 160, 200, 250]
      },
      "values": [
        [0.6328, 0.6697, 0.7028, 0.732, 0.763, 0.7879, 0.8067, 0.8195, 0.8262, 0.826, 0.8113, 0.7802, 0.7329, 0.6692, 0.5891],
        [0.6764, 0.7159, 0.7513, 0.7824, 0.8156, 0.8422, 0.8624, 0.876, 0.8831, 0.8829, 0.8672, 0.834, 0.7834, 0.7153, 0.6298],
        [0.7132, 0.7549, 0.7922, 0.8251, 0.86, 0.8881, 0.9093, 0.9237, 0.9312, 0.931, 0.9144, 0.8795, 0.8261, 0.7543, 0.664],
        [0.7417, 0.785, 0.8238, 0.858, 0.8943, 0.9235, 0.9456, 0.9605, 0.9684, 0.9681, 0.9509, 0.9145, 0.859, 0.7843, 0.6905],
        [0.7572, 0.8015, 0.841, 0.876, 0.913, 0.9429, 0.9654, 0.9807, 0.9887, 0.9884, 0.9708, 0.9337, 0.877, 0.8008, 0.705],
        [0.7572, 0.8015, 0.841, 0.876, 0.913, 0.9429, 0.9654, 0.9807, 0.9887, 0.9884, 0.9708, 0.9337, 0.877, 0.8008, 0.705],
        [0.7572, 0.8015, 0.841, 0.876, 0.913, 0.9429, 0.9654, 0.9807, 0.9887, 0.9884, 0.9708, 0.9337, 0.877, 0.8008, 0.705],
        [0.7572, 0.8015, 0.841, 0.876, 0.913, 0.9429, 0.9654, 0.9807, 0.9887, 0.9884, 0.9708, 0.9337, 0.877, 0.8008, 0.705],
        [0.7572, 0.8015, 0.841, 0.876, 0.913, 0.9429, 0.9654, 0.9807, 0.9887, 0.9884, 0.9708, 0.9337, 0.877, 0.8008, 0.705]
      ]
    },
    {
      "id": "boost_target",
      "unit": "kPa",
      "x": {
        "name": "rpm",
        "unit": "rpm",
        "values": [800, 1200, 1600, 2000, 2500, 3000, 3500, 4000, 4500, 5000, 5500, 6000, 6500, 7000, 7500]
      },
      "y": {
        "name": "pedal",
        "unit": "%",
        "values": [0, 10, 20, 35, 50, 70, 85, 100]
      },
      "values": [
        [0, 0, 0, 0, 0, 0, 0, 0, 0, 0, 0, 0, 0, 0, 0],
        [0, 0, 0, 0, 0, 0, 0, 0, 0, 0, 0, 0, 0, 0, 0],
        [0, 0, 0, 0, 0, 0, 0, 0, 0, 0, 0, 0, 0, 0, 0],
        [1.5134, 1.5134, 3.1159, 5.8906, 6.0537, 6.0537, 6.0537, 6.0537, 6.0537, 6.0537, 6.0537, 5.8183, 5.3811, 5.1457, 5.1457],
        [7.8374, 7.8374, 16.1357, 30.5047, 31.3496, 31.3496, 31.3496, 31.3496, 31.3496, 31.3496, 31.3496, 30.1304, 27.8663, 26.6471, 26.6471],
        [18.3881, 18.3881, 37.8578, 71.5703, 73.5526, 73.5526, 73.5526, 73.5526, 73.5526, 73.5526, 73.5526, 70.6922, 65.3801, 62.5197, 62.5197],
        [23.35, 23.35, 48.0734, 90.8829, 93.4001, 93.4001, 93.4001, 93.4001, 93.4001, 93.4001, 93.4001, 89.7679, 83.0223, 79.3901, 79.3901],
        [23.75, 23.75, 48.8969, 92.4397, 95, 95, 95, 95, 95, 95, 95, 91.3056, 84.4444, 80.75, 80.75]
      ]
    },
    {
      "id": "wastegate_duty",
      "unit": "%",
      "x": {
        "name": "rpm",
        "unit": "rpm",
        "values": [800, 1200, 1600, 2000, 2500, 3000, 3500, 4000, 4500, 5000, 5500, 6000, 6500, 7000, 7500]
      },
      "y": {
        "name": "pedal",
        "unit": "%",
        "values": [0, 10, 20, 35, 50, 70, 85, 100]
      },
      "values": [
        [0, 0, 0, 0, 0, 0, 0, 0, 0, 0, 0, 0, 0, 0, 0],
        [0, 0, 0, 0, 0, 0, 0, 0, 0, 0, 0, 0, 0, 0, 0],
        [0, 0, 0, 0, 0, 0, 0, 0, 0, 0, 0, 0, 0, 0, 0],
        [0, 0, 0, 0, 0, 0, 0, 0, 0, 0, 0, 0, 0, 0, 0],
        [0, 0, 0, 0, 0, 0, 0, 0, 0, 0, 0, 0, 0, 0, 0],
        [0, 0, 0, 20.3706, 21.8903, 21.8903, 21.8903, 21.8903, 21.8903, 21.8903, 21.8903, 19.6973, 15.6247, 13.4318, 13.4318],
        [0, 0, 2.3563, 35.1769, 37.1067, 37.1067, 37.1067, 37.1067, 37.1067, 37.1067, 37.1067, 34.322, 29.1504, 26.3657, 26.3657],
        [0, 0, 2.9876, 36.3704, 38.3333, 38.3333, 38.3333, 38.3333, 38.3333, 38.3333, 38.3333, 35.5009, 30.2407, 27.4083, 27.4083]
      ]
    }
  ],
  "curves": [
    {
      "id": "pedal_to_throttle",
      "unit": "%",
      "x": {
        "name": "pedal",
        "unit": "%",
        "values": [0, 10, 25, 50, 75, 100]
      },
      "values": [0, 4, 14, 38, 70, 100]
    },
    {
      "id": "ect_fuel_correction",
      "unit": "factor",
      "x": {
        "name": "ect",
        "unit": "°C",
        "values": [-20, 0, 20, 40, 60, 80]
      },
      "values": [1.45, 1.3, 1.15, 1.07, 1.02, 1]
    },
    {
      "id": "iat_ignition_correction",
      "unit": "deg",
      "x": {
        "name": "iat",
        "unit": "°C",
        "values": [-10, 20, 40, 55, 70, 90]
      },
      "values": [1, 0, 0, -1.5, -4, -7]
    },
    {
      "id": "ect_ignition_correction",
      "unit": "deg",
      "x": {
        "name": "ect",
        "unit": "°C",
        "values": [0, 40, 90, 105, 115]
      },
      "values": [3, 1.5, 0, -2, -5]
    }
  ],
  "scalars": {
    "rev_limit_rpm": 7100,
    "speed_limit_kmh": 250,
    "torque_limit_nm": 520,
    "idle_rpm": 720,
    "idle_cold_rpm": 1000,
    "injector_flow_ccmin": 550,
    "injector_dead_time_ms": 0.48,
    "maf_max_gps": 300,
    "fan_on_c": 104,
    "fan_off_c": 98,
    "knock_retard_step_deg": 1.5,
    "knock_retard_max_deg": 10,
    "overboost_limit_kpa": 140,
    "rail_pressure_target_kpa": 400,
    "map_sensor_max_kpa": 250
  }
}
